{"grading_periods":[{"id":"2201","grading_period_group_id":"812","start_date":"2026-08-17T04:00:00Z","end_date":"2026-10-17T03:59:59Z","close_date":"2026-10-24T03:59:59Z","weight":40.0,"title":"Quarter 1","permissions":{"read":true,"create":false,"update":false,"delete":false},"is_closed":false},{"id":"2202","grading_period_group_id":"812","start_date":"2026-10-17T04:00:00Z","end_date":"2026-12-19T04:59:59Z","close_date":"2026-12-24T04:59:59Z","weight":40.0,"title":"Quarter 2","permissions":{"read":true,"create":false,"update":false,"delete":false},"is_closed":false},{"id":"2203","grading_period_group_id":"812","start_date":"2026-12-19T05:00:00Z","end_date":"2027-01-23T04:59:59Z","close_date":"2027-01-30T04:59:59Z","weight":20.0,"title":"Semester Exam","permissions":{"read":true,"create":false,"update":false,"delete":false},"is_closed":false}],"meta":{"pagination":{"per_page":10,"last":"https://northgate.instructure.example/api/v1/courses/90411/grading_periods?page=1\u0026per_page=10","current":"https://northgate.instructure.example/api/v1/courses/90411/grading_periods?page=1\u0026per_page=10","first":"https://northgate.instructure.example/api/v1/courses/90411/grading_periods?page=1\u0026per_page=10","page":1,"template":"https://northgate.instructure.example/api/v1/courses/90411/grading_periods?page={page}\u0026per_page=10","count":3,"page_count":1},"primaryCollection":"grading_periods"},"can_create_grading_periods":false,"grading_periods_read_only":true}