{"grading_periods":[],"meta":{"pagination":{"per_page":10,"last":"https://canvas.northfield.example/api/v1/courses/58000/grading_periods?page=1\u0026per_page=10","current":"https://canvas.northfield.example/api/v1/courses/58000/grading_periods?page=1\u0026per_page=10","first":"https://canvas.northfield.example/api/v1/courses/58000/grading_periods?page=1\u0026per_page=10","page":1,"template":"https://canvas.northfield.example/api/v1/courses/58000/grading_periods?page={page}\u0026per_page=10","count":0,"page_count":1},"primaryCollection":"grading_periods"},"can_create_grading_periods":false,"grading_periods_read_only":true}