{"grading_periods":[{"id":"2201","grading_period_group_id":"812","start_date":"2026-08-24T05:00:00Z","end_date":"2026-10-01T04:59:59Z","close_date":"2026-10-08T04:59:59Z","weight":50.0,"title":"Period 1","permissions":{"read":true,"create":false,"update":false,"delete":false},"is_closed":false},{"id":"2202","grading_period_group_id":"812","start_date":"2026-10-01T05:00:00Z","end_date":"2026-12-20T05:59:59Z","close_date":"2026-12-24T05:59:59Z","weight":50.0,"title":"Period 2","permissions":{"read":true,"create":false,"update":false,"delete":false},"is_closed":false}],"meta":{"pagination":{"per_page":10,"last":"https://canvas.northfield.example/api/v1/courses/58000/grading_periods?page=1\u0026per_page=10","current":"https://canvas.northfield.example/api/v1/courses/58000/grading_periods?page=1\u0026per_page=10","first":"https://canvas.northfield.example/api/v1/courses/58000/grading_periods?page=1\u0026per_page=10","page":1,"template":"https://canvas.northfield.example/api/v1/courses/58000/grading_periods?page={page}\u0026per_page=10","count":2,"page_count":1},"primaryCollection":"grading_periods"},"can_create_grading_periods":false,"grading_periods_read_only":true}